{
  "template": "growth",
  "version": "1.0.0",
  "event": [
    "first-birthday"
  ],
  "styles": {
    "warm-illustration": "温暖的手绘插画风，柔和的奶油色和浅粉色，纸张质感，干净留白，画面中心是一个与成长节点相关的物件（如生日蛋糕、小鞋子、气球、奶瓶、小脚印），不出现任何人物或人脸，不出现文字，方形构图"
  },
  "sections": [
    {
      "id": "film",
      "label": "胶片滚动",
      "slots": [
        "film"
      ]
    },
    {
      "id": "milestones",
      "label": "成长里程碑",
      "slots": [
        "milestones"
      ]
    },
    {
      "id": "scatter",
      "label": "照片散落",
      "slots": [
        "scatter"
      ]
    },
    {
      "id": "floating",
      "label": "星空飞照片",
      "slots": [
        "floating"
      ]
    },
    {
      "id": "wall",
      "label": "照片墙",
      "slots": [
        "wall"
      ]
    }
  ],
  "slots": {
    "film": {
      "label": "胶片格",
      "display": {
        "size": "card",
        "aspect": [
          0.7,
          0.75
        ],
        "faceZone": [
          0.1,
          0.1,
          0.9,
          0.7
        ],
        "holdSeconds": 4,
        "brightness": "dark"
      },
      "people": {
        "require": [
          "baby"
        ],
        "count": [
          1,
          3
        ]
      },
      "shots": [
        "closeup",
        "half"
      ],
      "scenes": {
        "prefer": [
          "newborn-shoot",
          "sleeping",
          "held-by-family",
          "full-month-shoot"
        ],
        "avoid": [
          "ultrasound",
          "pregnancy-test"
        ]
      },
      "phase": {
        "prefer": [
          "birth",
          "m0",
          "m1-3"
        ],
        "order": "chronological"
      },
      "moods": [
        "calm",
        "joyful"
      ],
      "reuse": "never",
      "priority": 3,
      "note": "窄长竖格，背景越简单越好；横图会被裁成竖条，主体必须居中"
    },
    "milestones": {
      "label": "里程碑卡片（一张照片配一句话）",
      "display": {
        "size": "card",
        "aspect": [
          0.78,
          1.18
        ],
        "faceZone": [
          0.12,
          0.08,
          0.88,
          0.8
        ],
        "holdSeconds": 2.2,
        "brightness": "dark",
        "textSpace": "right"
      },
      "people": {
        "prefer": [
          "baby"
        ],
        "allowNone": true
      },
      "shots": [
        "closeup",
        "half",
        "full",
        "detail"
      ],
      "scenes": {
        "prefer": [
          "pregnancy-test",
          "ultrasound",
          "maternity",
          "delivery",
          "birth-record",
          "bath",
          "full-month-shoot",
          "hundred-days",
          "first-smile",
          "rollover",
          "sitting",
          "first-food",
          "crawling",
          "standing",
          "walking",
          "festival",
          "outing",
          "zhuazhou",
          "birthday-cake",
          "birthday-shoot"
        ]
      },
      "phase": {
        "prefer": [
          "pregnancy",
          "birth",
          "m0",
          "m1-3",
          "m4-6",
          "m7-9",
          "m10-12",
          "birthday"
        ],
        "order": "chronological",
        "spread": true
      },
      "moods": [
        "joyful",
        "touching",
        "calm"
      ],
      "copy": {
        "field": "captions[i]",
        "maxChars": 24,
        "maxLines": 2,
        "role": "caption"
      },
      "generation": {
        "mode": "fill",
        "style": "warm-illustration",
        "size": [
          1200,
          1200
        ]
      },
      "reuse": "never",
      "priority": 5,
      "note": "全片主线。按拍摄时间排序，每个时间阶段至少一张；每张对应需求表里的一个故事节点。没有照片的节点可以补一张不含真实人物的插画（如蛋糕、小脚印），并标记为生成图"
    },
    "scatter": {
      "label": "散落拼贴",
      "display": {
        "size": "thumb",
        "aspect": [
          0.72,
          1.5
        ],
        "holdSeconds": 6,
        "brightness": "dark"
      },
      "people": {
        "prefer": [
          "baby"
        ],
        "allowNone": false
      },
      "shots": [
        "closeup",
        "half",
        "full",
        "group"
      ],
      "moods": [
        "joyful",
        "funny"
      ],
      "reuse": "any",
      "priority": 2,
      "note": "日常抓拍和表情照，数量多比单张质量重要"
    },
    "floating": {
      "label": "星空飞照片",
      "display": {
        "size": "thumb",
        "aspect": [
          0.72,
          1.5
        ],
        "holdSeconds": 4,
        "brightness": "dark"
      },
      "people": {
        "prefer": [
          "baby"
        ]
      },
      "shots": [
        "closeup",
        "half"
      ],
      "moods": [
        "joyful",
        "calm"
      ],
      "reuse": "any",
      "priority": 2,
      "note": "显示很小，选主体大、颜色亮的照片；避开逆光、暗光、远景"
    },
    "wall": {
      "label": "照片墙",
      "display": {
        "size": "tile",
        "aspect": [
          0.75,
          1.5
        ],
        "holdSeconds": 15,
        "brightness": "light"
      },
      "people": {
        "prefer": [
          "baby",
          "parents-baby",
          "family"
        ]
      },
      "phase": {
        "order": "chronological",
        "spread": true
      },
      "reuse": "any",
      "priority": 2,
      "note": "最后的高潮段，按时间排出成长感；全家福放在后半段"
    }
  }
}
